{
  "$schema": "https://json-schema.org/draft/2020-12/schema",
  "additionalProperties": false,
  "properties": {
    "accepts": {
      "items": {
        "minLength": 1,
        "type": "string"
      },
      "minItems": 1,
      "type": "array"
    },
    "assistant_contestant_allowed": {
      "const": false
    },
    "authority_posture": {
      "const": "non_authority"
    },
    "canonical_status": {
      "const": "not_canon"
    },
    "forbidden_effects": {
      "items": {
        "minLength": 1,
        "type": "string"
      },
      "minItems": 1,
      "type": "array"
    },
    "kag_status": {
      "const": "candidate_only"
    },
    "live_protocol": {
      "const": false
    },
    "package_id": {
      "minLength": 1,
      "type": "string"
    },
    "package_status": {
      "enum": [
        "memo_evidence_candidate_only"
      ]
    },
    "produces": {
      "items": {
        "minLength": 1,
        "type": "string"
      },
      "minItems": 1,
      "type": "array"
    },
    "promotion_requires": {
      "items": {
        "minLength": 1,
        "type": "string"
      },
      "minItems": 1,
      "type": "array"
    },
    "purpose": {
      "minLength": 1,
      "type": "string"
    },
    "review_status": {
      "const": "candidate_only"
    },
    "runtime_effect": {
      "enum": [
        "none",
        "candidate_only",
        "local_dry_run_candidate_only",
        "local_rehearsal_candidate_only"
      ]
    },
    "source_truth_posture": {
      "const": "owner_retained"
    },
    "stop_lines": {
      "items": {
        "minLength": 1,
        "type": "string"
      },
      "minItems": 1,
      "type": "array"
    },
    "wave": {
      "const": "XVII"
    }
  },
  "required": [
    "accepts",
    "assistant_contestant_allowed",
    "authority_posture",
    "canonical_status",
    "forbidden_effects",
    "kag_status",
    "live_protocol",
    "package_id",
    "package_status",
    "produces",
    "promotion_requires",
    "purpose",
    "review_status",
    "runtime_effect",
    "source_truth_posture",
    "stop_lines",
    "wave"
  ],
  "title": "agon-kag-memo-evidence-package.schema.json item contract",
  "type": "object"
}
