{
  "accepts": [
    "trace_refs",
    "chronicle_refs",
    "retention_refs",
    "owner_refs"
  ],
  "assistant_contestant_allowed": false,
  "authority_posture": "non_authority",
  "canonical_status": "not_canon",
  "forbidden_effects": [
    "live_verdict_authority",
    "durable_scar_write",
    "retention_execution",
    "rank_mutation",
    "trust_mutation",
    "tree_of_sophia_promotion",
    "direct_tos_promotion",
    "kag_canonization",
    "kag_source_truth_claim",
    "hidden_scheduler_action",
    "assistant_contestant_drift",
    "auto_doctrine_rewrite",
    "center_takeover_of_owner_truth",
    "unreviewed_kag_promotion",
    "single_event_promotion",
    "stats_promotion_authority",
    "eval_promotion_authority"
  ],
  "kag_status": "candidate_only",
  "live_protocol": false,
  "package_id": "agon.memo.kag.evidence_bundle_candidate",
  "package_status": "memo_evidence_candidate_only",
  "produces": [
    "kag_evidence_package_candidate"
  ],
  "promotion_requires": [
    "owner_review",
    "memo_evidence_package",
    "eval_alignment",
    "recurrence_or_retention_support"
  ],
  "purpose": "Candidate evidence bundle for KAG promotion review.",
  "review_status": "candidate_only",
  "runtime_effect": "none",
  "source_truth_posture": "owner_retained",
  "stop_lines": [
    "no_live_verdict_authority",
    "no_durable_scar_write",
    "no_retention_execution",
    "no_rank_or_trust_mutation",
    "no_tree_of_sophia_promotion",
    "no_direct_tos_promotion",
    "no_kag_as_canon",
    "no_kag_as_source_truth",
    "no_hidden_scheduler_action",
    "no_assistant_contestant_drift",
    "no_auto_doctrine_rewrite",
    "no_center_takeover_of_owner_truth",
    "no_kag_promotion_without_owner_review",
    "no_promotion_from_single_event",
    "no_stats_as_promotion_authority",
    "no_eval_as_promotion_authority"
  ],
  "wave": "XVII"
}
